{
  "$schema": "https://json-schema.org/draft/2020-12/schema",
  "$id": "https://lumina.project/schema/allowed_tags.schema.json",
  "title": "Lumina Allowed Tags Schema",
  "type": "object",
  "required": [
    "genre",
    "topic",
    "form",
    "level",
    "audience",
    "period",
    "approach",
    "tone",
    "theme",
    "language"
  ],
  "additionalProperties": false,
  "properties": {
    "genre": {
      "type": "array",
      "items": {
        "type": "string"
      },
      "uniqueItems": true
    },
    "topic": {
      "type": "array",
      "items": {
        "type": "string"
      },
      "uniqueItems": true
    },
    "form": {
      "type": "array",
      "items": {
        "type": "string"
      },
      "uniqueItems": true
    },
    "level": {
      "type": "array",
      "items": {
        "type": "string"
      },
      "uniqueItems": true
    },
    "audience": {
      "type": "array",
      "items": {
        "type": "string"
      },
      "uniqueItems": true
    },
    "period": {
      "type": "array",
      "items": {
        "type": "string"
      },
      "uniqueItems": true
    },
    "approach": {
      "type": "array",
      "items": {
        "type": "string"
      },
      "uniqueItems": true
    },
    "tone": {
      "type": "array",
      "items": {
        "type": "string"
      },
      "uniqueItems": true
    },
    "theme": {
      "type": "array",
      "items": {
        "type": "string"
      },
      "uniqueItems": true
    },
    "language": {
      "type": "array",
      "items": {
        "type": "string"
      },
      "uniqueItems": true
    }
  }
}