{
  "genre": [
    "fantasy",
    "science-fiction",
    "historical-fiction",
    "speculative",
    "horror",
    "mystery",
    "crime",
    "thriller",
    "romance",
    "literary",
    "young-adult",
    "epic",
    "cyberpunk",
    "post-apocalyptic",
    "dystopian",
    "utopian",
    "noir",
    "cozy",
    "experimental",
    "superhero",
    "manga",
    "graphic-novel",
    "romantic-fantasy",
    "romantic-suspense"
  ],
  "topic": [
    "programming",
    "algorithms",
    "machine-learning",
    "artificial-intelligence",
    "philosophy",
    "ethics",
    "aesthetics",
    "gender-studies",
    "sexuality-studies",
    "queer-theory",
    "lgbtq-history",
    "relationships",
    "intimacy",
    "identity-formation"
  ],
  "form": [
    "textbook",
    "handbook",
    "reference",
    "manual",
    "method",
    "workbook",
    "anthology",
    "monograph",
    "essay-collection",
    "novel",
    "short-stories"
  ],
  "level": [
    "beginner",
    "intermediate",
    "advanced",
    "academic"
  ],
  "audience": [
    "general",
    "young-adult",
    "adult",
    "academic",
    "lgbtq"
  ],
  "period": [
    "modern",
    "20th-century",
    "21st-century",
    "contemporary"
  ],
  "approach": [
    "theoretical",
    "practical",
    "historical",
    "analytical",
    "narrative"
  ],
  "tone": [
    "academic",
    "accessible",
    "intimate",
    "romantic",
    "dark",
    "hopeful"
  ],
  "theme": [
    "identity",
    "gender",
    "sexuality",
    "lgbtq",
    "queer",
    "gay",
    "same-sex-relationships",
    "coming-out",
    "chosen-family",
    "love",
    "desire"
  ],
  "language": [
    "en",
    "bg",
    "de",
    "fr",
    "it",
    "es"
  ]
}

