{
  "genre": [
    "fantasy",
    "science-fiction",
    "historical-fiction",
    "speculative",
    "horror",
    "mystery",
    "crime",
    "thriller",
    "romance",
    "literary",
    "young-adult",
    "epic",
    "cyberpunk",
    "post-apocalyptic",
    "dystopian",
    "utopian",
    "noir",
    "cozy",
    "experimental",
    "superhero",
    "manga",
    "graphic-novel"
  ],
  "topic": [
    "harmony",
    "counterpoint",
    "analysis",
    "composition",
    "orchestration",
    "conducting",
    "ear-training",
    "sight-singing",
    "music-theory",
    "music-history",
    "music-technology",
    "sound-recording",
    "programming",
    "algorithms",
    "machine-learning",
    "artificial-intelligence",
    "data-science",
    "operating-systems",
    "databases",
    "cryptography",
    "networks",
    "philosophy",
    "ethics",
    "aesthetics",
    "politics",
    "history",
    "mythology",
    "textiles",
    "pattern-making",
    "sewing-machines",
    "knitting",
    "embroidery",
    "language-learning",
    "linguistics",
    "comics-history",
    "sequential-art",
    "illustration"
  ],
  "form": [
    "textbook",
    "handbook",
    "reference",
    "manual",
    "method",
    "workbook",
    "exercise-book",
    "etudes",
    "anthology",
    "monograph",
    "essay-collection",
    "tutorial",
    "guide",
    "comic-issue",
    "magazine-issue"
  ],
  "level": [
    "beginner",
    "intermediate",
    "advanced",
    "professional"
  ],
  "audience": [
    "children",
    "young-adult",
    "general",
    "academic",
    "professional"
  ],
  "period": [
    "ancient",
    "medieval",
    "renaissance",
    "baroque",
    "classical",
    "romantic",
    "modern",
    "20th-century",
    "21st-century",
    "contemporary"
  ],
  "approach": [
    "theoretical",
    "practical",
    "historical",
    "analytical",
    "comparative",
    "experimental"
  ],
  "tone": [
    "academic",
    "didactic",
    "accessible",
    "technical",
    "critical",
    "reflective",
    "humorous"
  ],
  "theme": [
    "identity",
    "gender",
    "sexuality",
    "lgbtq",
    "power",
    "religion",
    "myth",
    "technology",
    "nature",
    "society",
    "culture"
  ],
  "language": [
    "en",
    "bg",
    "de",
    "fr",
    "it",
    "es",
    "ru",
    "el",
    "la"
  ]
}